{
  "schemaVersion": 1,
  "enterpriseId": "replace-enterprise-id",
  "displayName": "待填写企业名称",
  "region": {
    "country": "CN",
    "province": "待填写",
    "city": "待填写"
  },
  "timezone": "Asia/Shanghai",
  "authorization": {
    "grantedBy": "enterprise-owner",
    "grantedAt": "2026-07-28T00:00:00.000Z",
    "allowedScopes": [
      "organization.read",
      "organization.draft.write"
    ],
    "deniedScopes": [
      "staff.compensation.read",
      "staff.performance.read",
      "staff.contract.read"
    ]
  },
  "organizationSummary": {},
  "sensitive": {},
  "facts": [],
  "unknowns": [],
  "version": 1,
  "createdAt": "2026-07-28T00:00:00.000Z",
  "updatedAt": "2026-07-28T00:00:00.000Z"
}
